{
  "schemaVersion": "janus.test-result.v1",
  "testRunId": "TEST-RUN-2026-05-16-002",
  "title": "Janus Filesystem Actions",
  "status": "PASS",
  "summary": {
    "total": 20,
    "passed": 20,
    "failed": 0,
    "blocked": 0,
    "manualGateRequired": 0
  },
  "artifacts": {
    "resultDirectory": "documentation/test-results/TEST-RUN-2026-05-16-002",
    "resultJson": "documentation/test-results/TEST-RUN-2026-05-16-002_results.json",
    "evidenceFiles": [
      "documentation/test-results/TEST-RUN-2026-05-16-002/INT-001-GEMINI_evidence.json",
      "documentation/test-results/TEST-RUN-2026-05-16-002/INT-001-GPT_evidence.json",
      "documentation/test-results/TEST-RUN-2026-05-16-002/INT-002-GEMINI_evidence.json",
      "documentation/test-results/TEST-RUN-2026-05-16-002/INT-002-GPT_evidence.json",
      "documentation/test-results/TEST-RUN-2026-05-16-002/INT-003-GEMINI_evidence.json",
      "documentation/test-results/TEST-RUN-2026-05-16-002/INT-003-GPT_evidence.json",
      "documentation/test-results/TEST-RUN-2026-05-16-002/INT-004-GEMINI_evidence.json",
      "documentation/test-results/TEST-RUN-2026-05-16-002/INT-004-GPT_evidence.json",
      "documentation/test-results/TEST-RUN-2026-05-16-002/INT-005-GEMINI_evidence.json",
      "documentation/test-results/TEST-RUN-2026-05-16-002/INT-005-GPT_evidence.json",
      "documentation/test-results/TEST-RUN-2026-05-16-002/LTC-001_evidence.json",
      "documentation/test-results/TEST-RUN-2026-05-16-002/LTC-002_evidence.json",
      "documentation/test-results/TEST-RUN-2026-05-16-002/PINJ-001-GEMINI_evidence.json",
      "documentation/test-results/TEST-RUN-2026-05-16-002/PINJ-001-GPT_evidence.json",
      "documentation/test-results/TEST-RUN-2026-05-16-002/SEC-001-GEMINI_evidence.json",
      "documentation/test-results/TEST-RUN-2026-05-16-002/SEC-001-GPT_evidence.json",
      "documentation/test-results/TEST-RUN-2026-05-16-002/SEC-002-GEMINI_evidence.json",
      "documentation/test-results/TEST-RUN-2026-05-16-002/SEC-002-GPT_evidence.json",
      "documentation/test-results/TEST-RUN-2026-05-16-002/TC-001-GEMINI_evidence.json",
      "documentation/test-results/TEST-RUN-2026-05-16-002/TC-001-GPT_evidence.json"
    ]
  },
  "results": [
    {
      "testCaseId": "INT-001-GEMINI",
      "result": "PASS",
      "classification": "ASSERTION_PASS",
      "evidencePath": "documentation/test-results/TEST-RUN-2026-05-16-002/INT-001-GEMINI_evidence.json",
      "durationMs": 0,
      "notes": "Expectations met",
      "timestamp": "2026-05-16T14:46:42.186Z"
    },
    {
      "testCaseId": "INT-001-GPT",
      "result": "PASS",
      "classification": "ASSERTION_PASS",
      "evidencePath": "documentation/test-results/TEST-RUN-2026-05-16-002/INT-001-GPT_evidence.json",
      "durationMs": 0,
      "notes": "Expectations met",
      "timestamp": "2026-05-16T14:46:03.512Z"
    },
    {
      "testCaseId": "INT-002-GEMINI",
      "result": "PASS",
      "classification": "ASSERTION_PASS",
      "evidencePath": "documentation/test-results/TEST-RUN-2026-05-16-002/INT-002-GEMINI_evidence.json",
      "durationMs": 0,
      "notes": "Expectations met",
      "timestamp": "2026-05-16T14:48:07.969Z"
    },
    {
      "testCaseId": "INT-002-GPT",
      "result": "PASS",
      "classification": "ASSERTION_PASS",
      "evidencePath": "documentation/test-results/TEST-RUN-2026-05-16-002/INT-002-GPT_evidence.json",
      "durationMs": 0,
      "notes": "Expectations met",
      "timestamp": "2026-05-16T14:47:13.159Z"
    },
    {
      "testCaseId": "INT-003-GEMINI",
      "result": "PASS",
      "classification": "ASSERTION_PASS",
      "evidencePath": "documentation/test-results/TEST-RUN-2026-05-16-002/INT-003-GEMINI_evidence.json",
      "durationMs": 0,
      "notes": "Expectations met",
      "timestamp": "2026-05-16T14:48:58.442Z"
    },
    {
      "testCaseId": "INT-003-GPT",
      "result": "PASS",
      "classification": "ASSERTION_PASS",
      "evidencePath": "documentation/test-results/TEST-RUN-2026-05-16-002/INT-003-GPT_evidence.json",
      "durationMs": 0,
      "notes": "Expectations met",
      "timestamp": "2026-05-16T14:48:32.183Z"
    },
    {
      "testCaseId": "INT-004-GEMINI",
      "result": "PASS",
      "classification": "ASSERTION_PASS",
      "evidencePath": "documentation/test-results/TEST-RUN-2026-05-16-002/INT-004-GEMINI_evidence.json",
      "durationMs": 0,
      "notes": "Expectations met",
      "timestamp": "2026-05-16T14:49:59.058Z"
    },
    {
      "testCaseId": "INT-004-GPT",
      "result": "PASS",
      "classification": "ASSERTION_PASS",
      "evidencePath": "documentation/test-results/TEST-RUN-2026-05-16-002/INT-004-GPT_evidence.json",
      "durationMs": 0,
      "notes": "Expectations met",
      "timestamp": "2026-05-16T14:49:23.172Z"
    },
    {
      "testCaseId": "INT-005-GEMINI",
      "result": "PASS",
      "classification": "ASSERTION_PASS",
      "evidencePath": "documentation/test-results/TEST-RUN-2026-05-16-002/INT-005-GEMINI_evidence.json",
      "durationMs": 0,
      "notes": "Expectations met",
      "timestamp": "2026-05-16T14:50:43.073Z"
    },
    {
      "testCaseId": "INT-005-GPT",
      "result": "PASS",
      "classification": "ASSERTION_PASS",
      "evidencePath": "documentation/test-results/TEST-RUN-2026-05-16-002/INT-005-GPT_evidence.json",
      "durationMs": 0,
      "notes": "Expectations met",
      "timestamp": "2026-05-16T14:50:22.201Z"
    },
    {
      "testCaseId": "LTC-001",
      "result": "PASS",
      "classification": "ASSERTION_PASS",
      "evidencePath": "documentation/test-results/TEST-RUN-2026-05-16-002/LTC-001_evidence.json",
      "durationMs": 0,
      "notes": "Expectations met",
      "timestamp": "2026-05-16T14:45:12.214Z"
    },
    {
      "testCaseId": "LTC-002",
      "result": "PASS",
      "classification": "ASSERTION_PASS",
      "evidencePath": "documentation/test-results/TEST-RUN-2026-05-16-002/LTC-002_evidence.json",
      "durationMs": 0,
      "notes": "Expectations met",
      "timestamp": "2026-05-16T14:45:35.926Z"
    },
    {
      "testCaseId": "PINJ-001-GEMINI",
      "result": "PASS",
      "classification": "ASSERTION_PASS",
      "evidencePath": "documentation/test-results/TEST-RUN-2026-05-16-002/PINJ-001-GEMINI_evidence.json",
      "durationMs": 0,
      "notes": "Expectations met",
      "timestamp": "2026-05-16T14:53:34.640Z"
    },
    {
      "testCaseId": "PINJ-001-GPT",
      "result": "PASS",
      "classification": "ASSERTION_PASS",
      "evidencePath": "documentation/test-results/TEST-RUN-2026-05-16-002/PINJ-001-GPT_evidence.json",
      "durationMs": 0,
      "notes": "Expectations met",
      "timestamp": "2026-05-16T14:53:13.050Z"
    },
    {
      "testCaseId": "SEC-001-GEMINI",
      "result": "PASS",
      "classification": "ASSERTION_PASS",
      "evidencePath": "documentation/test-results/TEST-RUN-2026-05-16-002/SEC-001-GEMINI_evidence.json",
      "durationMs": 0,
      "notes": "Expectations met",
      "timestamp": "2026-05-16T15:07:21.785Z"
    },
    {
      "testCaseId": "SEC-001-GPT",
      "result": "PASS",
      "classification": "ASSERTION_PASS",
      "evidencePath": "documentation/test-results/TEST-RUN-2026-05-16-002/SEC-001-GPT_evidence.json",
      "durationMs": 0,
      "notes": "Expectations met",
      "timestamp": "2026-05-16T14:51:08.904Z"
    },
    {
      "testCaseId": "SEC-002-GEMINI",
      "result": "PASS",
      "classification": "ASSERTION_PASS",
      "evidencePath": "documentation/test-results/TEST-RUN-2026-05-16-002/SEC-002-GEMINI_evidence.json",
      "durationMs": 0,
      "notes": "Expectations met",
      "timestamp": "2026-05-16T14:52:51.324Z"
    },
    {
      "testCaseId": "SEC-002-GPT",
      "result": "PASS",
      "classification": "ASSERTION_PASS",
      "evidencePath": "documentation/test-results/TEST-RUN-2026-05-16-002/SEC-002-GPT_evidence.json",
      "durationMs": 0,
      "notes": "Expectations met",
      "timestamp": "2026-05-16T14:52:20.888Z"
    },
    {
      "testCaseId": "TC-001-GEMINI",
      "result": "PASS",
      "classification": "ASSERTION_PASS",
      "evidencePath": "documentation/test-results/TEST-RUN-2026-05-16-002/TC-001-GEMINI_evidence.json",
      "durationMs": 0,
      "notes": "Expectations met",
      "timestamp": "2026-05-16T14:44:50.025Z"
    },
    {
      "testCaseId": "TC-001-GPT",
      "result": "PASS",
      "classification": "ASSERTION_PASS",
      "evidencePath": "documentation/test-results/TEST-RUN-2026-05-16-002/TC-001-GPT_evidence.json",
      "durationMs": 0,
      "notes": "Expectations met",
      "timestamp": "2026-05-16T14:44:10.617Z"
    }
  ],
  "updatedAt": "2026-05-16T15:07:21.794Z"
}